{
  "version": "1.0.0",
  "generated": "2025-11-29T22:20:21.295Z",
  "totalWorkers": 203,
  "categories": {
    "checklist": {
      "count": 6,
      "subcategories": [
        "quality"
      ],
      "description": "Quality validation checklists"
    },
    "data": {
      "count": 3,
      "subcategories": [
        "configuration",
        "knowledge"
      ],
      "description": "Knowledge base and configuration data"
    },
    "script": {
      "count": 54,
      "subcategories": [
        "analysis",
        "configuration",
        "generation",
        "management",
        "testing",
        "utility",
        "validation"
      ],
      "description": "JavaScript utility scripts"
    },
    "task": {
      "count": 115,
      "subcategories": [
        "analysis",
        "creation",
        "general",
        "modification",
        "validation"
      ],
      "description": "Executable task workflows for agents"
    },
    "template": {
      "count": 19,
      "subcategories": [
        "document",
        "ide-rules",
        "personalized"
      ],
      "description": "Document and code templates"
    },
    "workflow": {
      "count": 6,
      "subcategories": [
        "brownfield",
        "greenfield"
      ],
      "description": "Multi-step workflow definitions"
    }
  },
  "workers": [
    {
      "id": "architect-checklist",
      "name": "Architect Checklist",
      "description": "This checklist serves as a comprehensive framework for the Architect to validate the technical design and architecture before development execution. The Architect should systematically work through ea",
      "category": "checklist",
      "subcategory": "quality",
      "inputs": [],
      "outputs": [],
      "tags": [
        "checklist",
        "quality",
        "architect",
        "validation"
      ],
      "path": ".aios-core/product/checklists/architect-checklist.md",
      "taskFormat": "CHECKLIST",
      "executorTypes": [
        "Agent"
      ],
      "performance": {
        "avgDuration": "2m",
        "cacheable": false,
        "parallelizable": false
      },
      "agents": [
        "architect"
      ],
      "metadata": {
        "source": "product",
        "addedVersion": "1.0.0"
      }
    },
    {
      "id": "change-checklist",
      "name": "Change Checklist",
      "description": "Purpose: To systematically guide the selected Agent and user through the analysis and planning required when a significant change (pivot, tech issue, missing requirement, failed story) is identified d",
      "category": "checklist",
      "subcategory": "quality",
      "inputs": [],
      "outputs": [],
      "tags": [
        "checklist",
        "quality",
        "change",
        "validation"
      ],
      "path": ".aios-core/product/checklists/change-checklist.md",
      "taskFormat": "CHECKLIST",
      "executorTypes": [
        "Agent"
      ],
      "performance": {
        "avgDuration": "2m",
        "cacheable": false,
        "parallelizable": false
      },
      "agents": [],
      "metadata": {
        "source": "product",
        "addedVersion": "1.0.0"
      }
    },
    {
      "id": "pm-checklist",
      "name": "Pm Checklist",
      "description": "This checklist serves as a comprehensive framework to ensure the Product Requirements Document (PRD) and Epic definitions are complete, well-structured, and appropriately scoped for MVP development. T",
      "category": "checklist",
      "subcategory": "quality",
      "inputs": [],
      "outputs": [],
      "tags": [
        "checklist",
        "quality",
        "validation"
      ],
      "path": ".aios-core/product/checklists/pm-checklist.md",
      "taskFormat": "CHECKLIST",
      "executorTypes": [
        "Agent"
      ],
      "performance": {
        "avgDuration": "2m",
        "cacheable": false,
        "parallelizable": false
      },
      "agents": [
        "pm"
      ],
      "metadata": {
        "source": "product",
        "addedVersion": "1.0.0"
      }
    },
    {
      "id": "po-master-checklist",
      "name": "Po Master Checklist",
      "description": "This checklist serves as a comprehensive framework for the Product Owner to validate project plans before development execution. It adapts intelligently based on project type (greenfield vs brownfield",
      "category": "checklist",
      "subcategory": "quality",
      "inputs": [],
      "outputs": [],
      "tags": [
        "checklist",
        "quality",
        "master",
        "validation",
        "product"
      ],
      "path": ".aios-core/product/checklists/po-master-checklist.md",
      "taskFormat": "CHECKLIST",
      "executorTypes": [
        "Agent"
      ],
      "performance": {
        "avgDuration": "2m",
        "cacheable": false,
        "parallelizable": false
      },
      "agents": [
        "po"
      ],
      "metadata": {
        "source": "product",
        "addedVersion": "1.0.0"
      }
    },
    {
      "id": "story-dod-checklist",
      "name": "Story Dod Checklist",
      "description": "Before marking a story as 'Review', please go through each item in this checklist. Report the status of each item (e.g., [x] Done, [ ] Not Done, [N/A] Not Applicable) and provide brief comments if nec",
      "category": "checklist",
      "subcategory": "quality",
      "inputs": [],
      "outputs": [],
      "tags": [
        "checklist",
        "quality",
        "story",
        "dod",
        "validation",
        "product"
      ],
      "path": ".aios-core/product/checklists/story-dod-checklist.md",
      "taskFormat": "CHECKLIST",
      "executorTypes": [
        "Agent"
      ],
      "performance": {
        "avgDuration": "2m",
        "cacheable": false,
        "parallelizable": false
      },
      "agents": [],
      "metadata": {
        "source": "product",
        "addedVersion": "1.0.0"
      }
    },
    {
      "id": "story-draft-checklist",
      "name": "Story Draft Checklist",
      "description": "The Scrum Master should use this checklist to validate that each story contains sufficient context for a developer agent to implement it successfully, while assuming the dev agent has reasonable capab",
      "category": "checklist",
      "subcategory": "quality",
      "inputs": [],
      "outputs": [],
      "tags": [
        "checklist",
        "quality",
        "story",
        "draft",
        "validation",
        "product"
      ],
      "path": ".aios-core/product/checklists/story-draft-checklist.md",
      "taskFormat": "CHECKLIST",
      "executorTypes": [
        "Agent"
      ],
      "performance": {
        "avgDuration": "2m",
        "cacheable": false,
        "parallelizable": false
      },
      "agents": [],
      "metadata": {
        "source": "product",
        "addedVersion": "1.0.0"
      }
    },
    {
      "id": "agent-config-requirements",
      "name": "Agent Config Requirements",
      "description": "agents:",
      "category": "data",
      "subcategory": "configuration",
      "inputs": [],
      "outputs": [],
      "tags": [
        "data",
        "configuration",
        "agent",
        "config",
        "requirements"
      ],
      "path": ".aios-core/core/data/agent-config-requirements.yaml",
      "taskFormat": "TASK-FORMAT-V1",
      "executorTypes": [
        "Agent"
      ],
      "performance": {
        "avgDuration": "50ms",
        "cacheable": true,
        "parallelizable": true
      },
      "agents": [],
      "metadata": {
        "source": "core",
        "addedVersion": "1.0.0"
      }
    },
    {
      "id": "aios-kb",
      "name": "Aios Kb",
      "description": "AIOS-Method is a framework that combines AI agents with Agile development methodologies. The v4 system introduces a modular architecture with improved dependency management, bundle optimization, and s",
      "category": "data",
      "subcategory": "knowledge",
      "inputs": [],
      "outputs": [],
      "tags": [
        "data",
        "knowledge",
        "aios"
      ],
      "path": ".aios-core/core/data/aios-kb.md",
      "taskFormat": "TASK-FORMAT-V1",
      "executorTypes": [
        "Agent"
      ],
      "performance": {
        "avgDuration": "50ms",
        "cacheable": true,
        "parallelizable": true
      },
      "agents": [],
      "metadata": {
        "source": "core",
        "addedVersion": "1.0.0"
      }
    },
    {
      "id": "workflow-patterns",
      "name": "Workflow Patterns",
      "description": "workflows:",
      "category": "data",
      "subcategory": "configuration",
      "inputs": [],
      "outputs": [],
      "tags": [
        "data",
        "configuration",
        "workflow",
        "patterns"
      ],
      "path": ".aios-core/core/data/workflow-patterns.yaml",
      "taskFormat": "TASK-FORMAT-V1",
      "executorTypes": [
        "Agent"
      ],
      "performance": {
        "avgDuration": "50ms",
        "cacheable": true,
        "parallelizable": true
      },
      "agents": [],
      "metadata": {
        "source": "core",
        "addedVersion": "1.0.0"
      }
    },
    {
      "id": "aios-validator",
      "name": "Aios Validator",
      "description": "AIOS-FullStack Validation System",
      "category": "script",
      "subcategory": "validation",
      "inputs": [],
      "outputs": [],
      "tags": [
        "script",
        "validation",
        "aios",
        "validator"
      ],
      "path": ".aios-core/infrastructure/scripts/aios-validator.js",
      "taskFormat": "SCRIPT",
      "executorTypes": [
        "CLI",
        "Script"
      ],
      "performance": {
        "avgDuration": "500ms",
        "cacheable": true,
        "parallelizable": true
      },
      "agents": [],
      "metadata": {
        "source": "infrastructure",
        "addedVersion": "1.0.0"
      }
    },
    {
      "id": "approval-workflow",
      "name": "Approval Workflow",